Chapter,Media Link,Media Credit,Media Credit Link,Description,Zoom,Marker,Marker Color,Location,Latitude,Longitude,Overlay,Overlay Transparency,GeoJSON Overlay,GeoJSON Feature Properties
About Disneyland,,,,"One of the few places in the world where children and adults can have fun is an amusement park. Even more if they have all the most exciting attractions, as is the case with the Disney park complexes located around the world.

Disney has been in charge of keeping most people entertained, not only with its movies or television series but also with its intriguing themes in each of its parks. That's why we've compiled a list of Disney parks around the world that, despite being under the same ownership, have a distinct local flavor.",5,Hidden,blue,,,,,,,
"Walt Disney World, Orlando - Florida.",https://upload.wikimedia.org/wikipedia/commons/thumb/6/6d/Magic_Kingdom_Hub.jpg/1024px-Magic_Kingdom_Hub.jpg,Source: Spmartin15 CC BY-SA 4.0,https://upload.wikimedia.org/wikipedia/commons/thumb/6/6d/Magic_Kingdom_Hub.jpg/1024px-Magic_Kingdom_Hub.jpg,"Magic Kingdom Park is the fulfillment of all our childhood aspirations. Enjoy the rides, beautiful fireworks, musical parades, and meet Disney characters. Explore Adventureland, Frontierland, Liberty Square, Fantasyland, Tomorrowland, and Main Street, U.S.A. And the most beautiful thing is to see the fireworks over Cinderella's Castle.",7,Plain,blue,"Walt Disney World, Orlando FL",28.4334,-81.57834,,,,
"Disneyland, Anaheim - California.",https://upload.wikimedia.org/wikipedia/commons/thumb/2/2d/Sleeping_Beauty_Castle_2019.jpg/1024px-Sleeping_Beauty_Castle_2019.jpg,Source: CrispyCream27 CC BY-SA 4.0,https://upload.wikimedia.org/wikipedia/commons/thumb/2/2d/Sleeping_Beauty_Castle_2019.jpg/1024px-Sleeping_Beauty_Castle_2019.jpg,"This park has its doors open to the public since 1955. A curious fact is that it is the only one designed and built under the direct supervision of Walt Disney. Among its attractions are the famous Main Street USA, Tomorrowland, Fantasyland, Adventureland, New Orleans Square, Critter Country, Mickey's Toontown, Frontierland and Star Wars: Galaxy's Edge, and of course the beautiful Sleeping Beauty Castle.",3,Plain,pink,"Disneyland, Anaheim CA",33.813,-117.91828,,,,
"Disneyland, Paris - France.",https://upload.wikimedia.org/wikipedia/en/8/84/SleepingBeautyCastleDisneylandParisl.jpg,Source:  Anthony Atkielski CC BY-SA 3.0,https://upload.wikimedia.org/wikipedia/en/8/84/SleepingBeautyCastleDisneylandParisl.jpg,"Disneyland Park, originally Euro Disneyland, opened its doors on April 12, 1992. This park features Main Street, U.S.A., Frontierland, Adventureland, Fantasyland and Discoveryland. In this park, the Sleeping Beauty Castle and Disney characters stand out.",4,Plain,purple,"Disneyland, Paris France",48.86749,2.7836,,,,
Shanghai Disneyland - China.,https://upload.wikimedia.org/wikipedia/commons/thumb/5/51/Enchanted_Storybook_Castle.jpg/1024px-Enchanted_Storybook_Castle.jpg,Source: Jeremy Thompson CC BY 2.0,https://upload.wikimedia.org/wikipedia/commons/thumb/5/51/Enchanted_Storybook_Castle.jpg/1024px-Enchanted_Storybook_Castle.jpg,"On May 7, 2016, Shanghai Disneyland had started openings. This theme park combines Disney themes like Mickey Avenue, Gardens of Imagination, Fantasyland, Treasure Cove, Adventure Isle, Tomorrowland, Toy Story Land and of course its unique Enchanted Storybook Castle.",6,Plain,red,"Shanghai Disneyland, China",31.14357,121.65784,,,,
Tokyo Disneyland - Japan. ,https://upload.wikimedia.org/wikipedia/commons/3/3c/TDL_Cinderella_Castle_New_Color.jpg,Source: ARICAD CC BY-SA 3.0,https://upload.wikimedia.org/wikipedia/commons/3/3c/TDL_Cinderella_Castle_New_Color.jpg,"It was the first Disney park to be built outside the United States and it opened on April 15, 1983. The park has seven themed areas like the World Bazaar; Adventureland, Westernland, Fantasyland and Tomorrowland, Critter Country and Toontown. It features Cinderella's Castle just like the Magic Kingdom at Walt Disney World as its centerpiece.",3,Plain,cyan,"Tokyo Disneyland, Japan",35.63325,139.88044,,,,
Hong Kong Disneyland - China.,https://upload.wikimedia.org/wikipedia/commons/thumb/c/cd/20201019_Castle_of_Magical_Dreams.jpg/800px-20201019_Castle_of_Magical_Dreams.jpg,Source: Ngchikit CC BY-SA 4.0,https://upload.wikimedia.org/wikipedia/commons/thumb/c/cd/20201019_Castle_of_Magical_Dreams.jpg/800px-20201019_Castle_of_Magical_Dreams.jpg,"Hong Kong Disneyland opened to visitors on September 12, 2005. The park consists of seven themed areas: Main Street, U.S.A., Fantasyland, Adventureland, Tomorrowland, Grizzly Gulch, Mystic Point, and Toy Story Land. A fun fact is that the theme park cast members speak Cantonese, English, and Mandarin. It has the Castle of Magical Dreams that pays tribute to all the Disney princesses.",6,Plain,green,"Hong Kong Disneyland, China",22.31439,114,,,,